<?xml version="1.0" encoding="UTF-8"?>
<!DOCTYPE gopher-data SYSTEM "gopher-data.dtd">
<!--
test-nodes for Shekhar
-->
<gopher-data>
	<test-node>
		<id>10</id>
		<!-- Use default
		<node-ip>10.79.84.196</node-ip>
		-->
		<node-port>5557</node-port>
		<platform>WIN7</platform>
		<user-name>gopher</user-name>
		<!--
		<password></password>
		-->
		<install-dir>C:\\JARnDRIVER</install-dir>
		<selenium-server>selenium-server-standalone-2.44.0.jar</selenium-server>
		<supported-browser-id>0</supported-browser-id>
		<!--
		<supported-browser-id>1</supported-browser-id>
		<supported-browser-id>2</supported-browser-id>
		<supported-browser-id>3</supported-browser-id>
		-->
	</test-node>
	<!--
	<test-node>
		<id>11</id>
		<node-ip>10.79.82.152</node-ip>
		<node-port>5557</node-port>
		<platform>WIN7</platform>
		<user-name>gopher</user-name>
		<password></password>
		<install-dir>C:\\JARnDRIVER</install-dir>
		<selenium-server>selenium-server-standalone-2.44.0.jar</selenium-server>
		<supported-browser-id>1</supported-browser-id>
		<supported-browser-id>0</supported-browser-id>
		<supported-browser-id>2</supported-browser-id>
		<supported-browser-id>3</supported-browser-id>
	</test-node>
	-->
</gopher-data>